[
  {
    "variant_id": "prompt-v1-gemini-flash",
    "variant_config": {
      "variant_id": "prompt-v1-gemini-flash",
      "description": "Original extraction prompt with Gemini 2.0 Flash",
      "model": "gemini-2.0-flash",
      "prompt_template": "v1",
      "parameters": {
        "temperature": 0.1,
        "top_p": 0.95
      },
      "cost_per_1k_tokens_input": 7.5e-05,
      "cost_per_1k_tokens_output": 0.0003
    },
    "run_timestamp": "2026-04-23T15:05:15Z",
    "is_mock_run": true,
    "sample_id": "bench-sample-v1",
    "sample_size": 82,
    "metrics": {
      "true_positives": 28,
      "false_positives": 0,
      "false_negatives": 0,
      "true_negatives": 54,
      "precision": 1.0,
      "recall": 1.0,
      "false_positive_rate": 0.0,
      "time_per_record_s": 0.0,
      "cost_per_record_usd": 0.0
    }
  },
  {
    "variant_id": "prompt-v2-gemini-pro",
    "variant_config": {
      "variant_id": "prompt-v2-gemini-pro",
      "description": "Improved extraction prompt with Gemini 2.5 Pro",
      "model": "gemini-2.5-pro-preview-05-06",
      "prompt_template": "v2",
      "parameters": {
        "temperature": 0.05,
        "top_p": 0.9
      },
      "cost_per_1k_tokens_input": 0.00125,
      "cost_per_1k_tokens_output": 0.005
    },
    "run_timestamp": "2026-04-23T15:05:16Z",
    "is_mock_run": true,
    "sample_id": "bench-sample-v1",
    "sample_size": 82,
    "metrics": {
      "true_positives": 28,
      "false_positives": 0,
      "false_negatives": 0,
      "true_negatives": 54,
      "precision": 1.0,
      "recall": 1.0,
      "false_positive_rate": 0.0,
      "time_per_record_s": 0.0,
      "cost_per_record_usd": 0.0
    }
  },
  {
    "variant_id": "prompt-v3-gemini-flash-strict",
    "variant_config": {
      "variant_id": "prompt-v3-gemini-flash-strict",
      "description": "Stricter extraction prompt with Gemini 2.0 Flash — higher confidence threshold, rejects designators and value-only extractions",
      "model": "gemini-2.0-flash",
      "prompt_template": "v3-strict",
      "parameters": {
        "temperature": 0.05,
        "top_p": 0.85
      },
      "cost_per_1k_tokens_input": 7.5e-05,
      "cost_per_1k_tokens_output": 0.0003
    },
    "run_timestamp": "2026-04-23T15:05:16Z",
    "is_mock_run": true,
    "sample_id": "bench-sample-v1",
    "sample_size": 82,
    "metrics": {
      "true_positives": 28,
      "false_positives": 0,
      "false_negatives": 0,
      "true_negatives": 54,
      "precision": 1.0,
      "recall": 1.0,
      "false_positive_rate": 0.0,
      "time_per_record_s": 0.0,
      "cost_per_record_usd": 0.0
    }
  }
]
